<?xml version="1.0" encoding="UTF-8"?><book xmlns="https://www.custom-ebooks.com/database-schema" xmlns:xsi="http://www.w3.org/2001/XMLSchema-instance" xsi:schemaLocation="https://www.custom-ebooks.com/database-schema xmldb:exist:///db/CustomEbooks/custom_ebooks_schema.xsd">
<name>Database Systems</name>
<chapters>
<chapter>
<name>cloud paper 1</name>
<chapter_id>1</chapter_id>
<keywords>cloud computing</keywords>
<storage_path>/opt/tomcat/webapps/Custom-eBooks//uploads/06664451.pdf</storage_path>
</chapter>
</chapters>
</book>
