<?xml version="1.0"?>
<book xmlns="https://www.custom-ebooks.com/database-schema"
      xmlns:xsi="http://www.w3.org/2001/XMLSchema-instance"
      xsi:schemaLocation="https://www.custom-ebooks.com/database-schema
                          xmldb:exist:///db/Testing/custom_ebooks_schema.xsd">
        <name>Database Systems</name>
        <book_id>1</book_id>
        <keywords>data base db</keywords>
        <chapters>
          <chapter>
            <name>Chapter 1</name>
            <chapter_id>CH1</chapter_id>
            <keywords>dbch1 ch1</keywords>
            <sections>
                <section>
                  <name>section 1</name>
                  <section_id>SEC1</section_id>
                  <storage_path>TODO</storage_path>
                </section>

                <section>
                  <name>section 2</name>
                  <section_id>SEC2</section_id>
                  <storage_path>TODO</storage_path>
                </section>
            </sections>
          </chapter>

          <chapter>
            <name>Chapter 2</name>
            <chapter_id>CH2</chapter_id>
          </chapter>
        </chapters>
</book>
